[
  {
    "id": "eu-index-ventures",
    "name": {
      "en": "Index Ventures"
    },
    "aka": [],
    "type": "vc",
    "subtypes": [
      "growth-equity"
    ],
    "status": "active",
    "founded_year": 1996,
    "region": "europe",
    "country": "United Kingdom",
    "hq_city": "London",
    "offices": [
      {
        "country": "United States",
        "city": "San Francisco"
      },
      {
        "country": "United States",
        "city": "New York"
      },
      {
        "country": "Switzerland",
        "city": "Geneva"
      }
    ],
    "website": "https://www.indexventures.com",
    "capital": {
      "aum": {
        "raw": "€11.7 billion",
        "usd": null,
        "currency": "EUR"
      }
    },
    "strategy": {
      "stages": [
        "seed",
        "series-a",
        "series-b",
        "growth"
      ],
      "lead_or_follow": "both",
      "geo_focus": [
        "Europe",
        "United States",
        "Israel"
      ],
      "sector_focus": [
        "digital-health",
        "healthcare-services"
      ],
      "thesis": "Generalist tech VC with a standing, filterable Healthcare vertical on its own portfolio site; spun off its dedicated life-sciences/biotech practice as the independent firm Medicxi in 2016 (already catalogued as eu-medicxi), so Index Ventures' own current health exposure is digital-health / healthcare-services technology rather than therapeutics."
    },
    "lifesci": {
      "company_creation": false,
      "invests_public_markets": false
    },
    "track_record": {
      "notable_investments": [
        {
          "company": "Alan",
          "sector": "digital-health",
          "outcome": "active"
        },
        {
          "company": "Birdie",
          "sector": "healthcare-services",
          "outcome": "active"
        },
        {
          "company": "Kry / Livi",
          "sector": "digital-health",
          "outcome": "active"
        }
      ]
    },
    "tags": [
      "generalist-tech-vc",
      "life-sciences-spinoff",
      "europe-us-israel"
    ],
    "summary": {
      "en": "London/San Francisco/Geneva multi-stage tech VC (€11.7B AUM, founded 1996) that spun off its dedicated life-sciences practice as the independent firm Medicxi in 2016; retains a standing Healthcare filter on its own portfolio site and has repeatedly led/co-led digital-health and health-services rounds (Alan, Birdie, Kry/Livi) from its generalist tech funds."
    },
    "sources": [
      {
        "url": "https://en.wikipedia.org/wiki/Index_Ventures",
        "title": "Index Ventures",
        "publisher": "Wikipedia",
        "accessed": "2026-08-16",
        "supports": "Founding year, founders, HQ/offices, AUM, 2016 Medicxi spinoff",
        "quote": "the firm spun off its life sciences business in 2016 as Medicxi Ventures, an independent venture capital firm specializing in life-sciences investments"
      },
      {
        "url": "https://techcrunch.com/2016/08/19/video-call-your-doctor-startup-kry-raises-e6-1m-seed-led-by-index-and-creandum/",
        "title": "Video-call-your-doctor startup Kry raises €6.1M seed led by Index and Creandum",
        "publisher": "TechCrunch",
        "accessed": "2026-08-16",
        "supports": "Index Ventures co-lead of Kry/Livi seed round",
        "quote": "seed led by Index and Creandum"
      }
    ],
    "confidence": "medium",
    "verification_notes": "Distinct from eu-medicxi (the 2016 life-sciences spinout, already catalogued) — Index Ventures itself has no named health/bio partner post-spinoff, but qualifies on repeat digital-health/health-services deal volume via its generalist practice (3 portfolio companies found this session).",
    "last_updated": "2026-08-16",
    "researched_by": "r10-investor-gaps-final"
  },
  {
    "id": "eu-generation-investment-management",
    "name": {
      "en": "Generation Investment Management"
    },
    "aka": [
      "Generation IM"
    ],
    "type": "growth-equity",
    "subtypes": [
      "crossover-fund"
    ],
    "status": "active",
    "founded_year": 2004,
    "region": "europe",
    "country": "United Kingdom",
    "hq_city": "London",
    "offices": [
      {
        "country": "United States",
        "city": "San Francisco"
      }
    ],
    "website": "https://www.generationim.com",
    "capital": {},
    "strategy": {
      "stages": [
        "growth",
        "all"
      ],
      "lead_or_follow": "follow",
      "geo_focus": [
        "Global"
      ],
      "sector_focus": [
        "healthcare-it",
        "ai-drug-discovery"
      ],
      "thesis": "Sustainability/ESG-focused investment firm (Al Gore, David Blood) running Global Equity, Asia Equity, Growth Equity and Private Equity strategies; not a dedicated health investor, but its Growth Equity strategy has repeatedly backed health-adjacent AI/data infrastructure companies (BenchSci's AI drug-discovery platform, Innovaccer's healthcare-AI platform) as part of its broader sustainability thesis."
    },
    "lifesci": {
      "invests_public_markets": true,
      "company_creation": false
    },
    "track_record": {
      "notable_investments": [
        {
          "company": "BenchSci",
          "sector": "ai-drug-discovery",
          "outcome": "active"
        },
        {
          "company": "Innovaccer",
          "sector": "healthcare-it",
          "outcome": "active"
        }
      ]
    },
    "tags": [
      "esg-generalist",
      "growth-equity",
      "sustainability-thesis"
    ],
    "summary": {
      "en": "London-headquartered sustainability/ESG investment firm co-founded by Al Gore and David Blood in 2004; its Growth Equity strategy has led/joined growth rounds in two AI-driven healthcare platforms (BenchSci, Innovaccer), though it has no dedicated health team or fund."
    },
    "sources": [
      {
        "url": "https://en.wikipedia.org/wiki/Generation_Investment_Management",
        "title": "Generation Investment Management",
        "publisher": "Wikipedia",
        "accessed": "2026-08-16",
        "supports": "Founding year, founders, HQ, four investment strategies including Growth Equity",
        "quote": "Global Equity, Asia Equity, Growth Equity and Private Equity"
      },
      {
        "url": "https://betakit.com/benchsci-closes-95-million-cad-series-d-to-expand-ai-drug-discovery-platform/",
        "title": "BenchSci closes $95M CAD Series D",
        "publisher": "BetaKit",
        "accessed": "2026-08-16",
        "supports": "Generation Investment Management led BenchSci Series D",
        "quote": "$95 million CAD Series D"
      }
    ],
    "confidence": "low",
    "verification_notes": "Explicitly rejected in round 2 as a single-incidental-deal generalist ESG fund; this round found a second independent health-adjacent deal (Innovaccer) alongside BenchSci, meeting the 'multiple health investments' clause, but the firm still has no dedicated health practice, hence low confidence.",
    "last_updated": "2026-08-16",
    "researched_by": "r10-investor-gaps-final"
  }
]